{
  "$schema": "../../plugin.schema.json",
  "name": "主页",
  "id": "Home",
  "description": "官方主页",
  "versionName": "1.0.0",
  "versionCode": 1,
  "authors": [
    {
      "name": "ENHON Dev Team",
      "link": "https://github.com/ENHON-Dev-Team"
    }
  ],
  "icon": "home",
  "entry": "index.js",
  "page": "index.html",
  "settingsPage": "settings.html"
}