{
  "$schema": "../../plugin.schema.json",
  "name": "插件",
  "id": "Plugin",
  "description": "官方插件管理页",
  "versionName": "1.0.0",
  "versionCode": 1,
  "authors": [
    {
      "name": "ENHON Dev Team",
      "link": "https://github.com/ENHON-Dev-Team"
    }
  ],
  "icon": "extension",
  "entry": "index.js",
  "page": "index.html"
}